{
  "schema_version": "liqi.deployment.rollback/v1",
  "rollback_id": "rollback-example-v1",
  "from_release_id": "liqi-v1-example",
  "target_release_id": null,
  "target_git_sha": null,
  "target_manifest_sha256": null,
  "database_compatibility": "blocked",
  "config_compatibility": "blocked",
  "maximum_duration_seconds": 300,
  "status": "engineering-complete-evidence-pending",
  "started_at": "2026-07-18T00:00:00Z",
  "completed_at": null,
  "approval_reference": null,
  "checks": [
    {
      "name": "live-rollback-evidence",
      "status": "blocked",
      "detail": "No approved live rollback drill has occurred."
    }
  ],
  "evidence_class": "dry-run",
  "recovery_mode": "deactivate-first-release"
}
